{
  "$schema": "http:\/\/json-schema.org\/draft-04\/schema#",
  "id": "urn:schema.phpsx.org#",
  "definitions": {
    "Entry": {
      "type": "object",
      "title": "entry",
      "properties": {
        "id": {
          "type": "integer"
        },
        "title": {
          "type": "string"
        },
        "content": {
          "type": "string"
        },
        "date": {
          "type": "string",
          "format": "date-time"
        }
      }
    }
  },
  "type": "object",
  "title": "collection",
  "properties": {
    "totalResults": {
      "type": "integer"
    },
    "itemsPerPage": {
      "type": "integer"
    },
    "startIndex": {
      "type": "integer"
    },
    "entry": {
      "type": "array",
      "items": {
        "$ref": "#\/definitions\/Entry"
      }
    }
  }
}