{
  "totalResults": 1,
  "startIndex": 0,
  "itemsPerPage": 16,
  "entry": [
    {
      "id": 1,
      "firstName": "Christoph",
      "lastName": "Kappestein",
      "location": {
        "id": 1,
        "name": "foo",
        "latitude": "50.883331",
        "longitude": "8.016667"
      },
      "tags": [
        "foo",
        "bar"
      ],
      "categories": [
        {
          "id": 1,
          "name": "foo"
        }
      ],
      "map": {
        "foo": {
          "id": 1,
          "name": "foo",
          "latitude": "50.883331",
          "longitude": "8.016667"
        },
        "bar": {
          "id": 1,
          "name": "foo",
          "latitude": "50.883331",
          "longitude": "8.016667"
        }
      }
    }
  ]
}